{
  "$schema": "https://json-schema.org/draft/2020-12/schema",
  "$id": "https://beosound5c.com/config.schema.json",
  "title": "BeoSound 5c Configuration",
  "description": "Device configuration for a BeoSound 5c unit. Lives at /etc/beosound5c/config.json on the device.",
  "type": "object",
  "required": ["device"],
  "properties": {
    "cameras": {
      "type": "array",
      "description": "Cameras for the door/gate overlay (shown when Home Assistant pushes a show_camera command). Entity ids are specific to your Home Assistant install, so the shipped defaults are placeholders — set this to your own.",
      "items": {
        "type": "object",
        "properties": {
          "id": { "type": "string", "description": "Short id, e.g. \"door\"." },
          "title": { "type": "string", "description": "Label shown on the overlay." },
          "entity": { "type": "string", "description": "Home Assistant camera entity id.", "examples": ["camera.front_door"] }
        },
        "required": ["id", "title", "entity"]
      }
    },
    "device": {
      "type": "string",
      "description": "Display name of this device. Used in MQTT topics, webhook payloads, and UI labels.",
      "examples": ["Living Room", "Kitchen", "Church"]
    },

    "menu": {
      "type": "object",
      "description": "Menu items shown on the main arc. Keys are display labels (uppercase), values are source IDs or source config objects. Order determines arc order. Two views are left out of the default install because they only do something with a matching Home Assistant setup: \"SHOWING\": \"showing\" (what is playing on an Apple TV — needs showing.entity_id) and \"SECURITY\": {\"url\": \"softarc/security.html\"} (camera snapshots — needs security.cameras). Add either by hand once configured.",
      "additionalProperties": {
        "oneOf": [
          {
            "type": "string",
            "description": "Simple source/view ID.",
            "examples": ["playing", "spotify", "scenes", "system", "showing"]
          },
          {
            "$ref": "#/$defs/menuItem"
          }
        ]
      },
      "examples": [{
        "PLAYING": "playing",
        "CD": { "id": "cd", "hidden": true },
        "SPOTIFY": "spotify",
        "SCENES": "scenes",
        "SYSTEM": "system"
      }]
    },

    "scenes": {
      "type": "array",
      "description": "Scene definitions shown when the SCENES menu item is selected. Scenes trigger Home Assistant actions via the webhook/MQTT transport.",
      "items": { "$ref": "#/$defs/scene" }
    },

    "player": {
      "type": "object",
      "description": "External player service configuration. The player handles audio playback, monitoring, and artwork.",
      "required": ["type", "ip"],
      "properties": {
        "type": {
          "type": "string",
          "enum": ["sonos", "bluesound", "heos", "wiim", "mozart", "ase", "local", "none"],
          "description": "Player type. Determines which player service handles playback; the type guard ensures only the matching one runs. 'wiim' drives a WiiM/LinkPlay speaker via the LinkPlay HTTP API. 'mozart' (experimental) drives a modern B&O speaker via the Mozart Open API (Beolink multiroom). 'ase' (experimental) drives an older B&O speaker via the BeoZone/BeoNotify product API. 'local' plays on the Pi via mpv/librespot; 'none' runs no player (fresh-install default until setup)."
        },
        "ip": {
          "type": "string",
          "format": "ipv4",
          "description": "IP address of the player device (Sonos speaker, BluOS player, or HEOS device)."
        }
      },
      "additionalProperties": false
    },

    "bluetooth": {
      "type": "object",
      "description": "BeoRemote One Bluetooth configuration.",
      "properties": {
        "remote_mac": {
          "type": "string",
          "pattern": "^([0-9A-Fa-f]{2}:){5}[0-9A-Fa-f]{2}$|^$",
          "description": "MAC address of the paired BeoRemote One. Empty string to disable Bluetooth remote.",
          "examples": ["AA:BB:CC:DD:EE:FF", ""]
        }
      },
      "additionalProperties": false
    },

    "home_assistant": {
      "type": "object",
      "description": "Home Assistant connection settings.",
      "properties": {
        "url": {
          "type": "string",
          "format": "uri",
          "description": "Home Assistant base URL. Used for embedding dashboards (Security page) and API calls.",
          "default": "http://homeassistant.local:8123"
        },
        "webhook_url": {
          "type": "string",
          "format": "uri",
          "description": "HA webhook endpoint for button/event forwarding (used when transport.mode is 'webhook' or 'both').",
          "default": "http://homeassistant.local:8123/api/webhook/beosound5c"
        },
        "panel": {
          "type": "array",
          "description": "Entities shown in the HOME view, in this order. Read-only readouts. Requires HA_TOKEN in secrets.env; no Home Assistant configuration changes are needed. See docs/home-assistant.md.",
          "items": {
            "oneOf": [
              { "type": "string", "description": "Entity id; the label comes from the entity's friendly_name." },
              {
                "type": "object",
                "required": ["entity"],
                "properties": {
                  "entity": { "type": "string", "description": "Home Assistant entity id.", "examples": ["sensor.outdoor_temperature"] },
                  "label": { "type": "string", "description": "Override the entity's friendly_name." },
                  "icon": { "type": "string", "description": "Phosphor icon name, e.g. \"thermometer-simple\". Defaults to one picked from the entity domain." }
                },
                "additionalProperties": false
              }
            ]
          },
          "default": []
        }
      },
      "additionalProperties": false
    },

    "transport": {
      "type": "object",
      "description": "Communication transport between BS5c and Home Assistant.",
      "properties": {
        "mode": {
          "type": "string",
          "enum": ["webhook", "mqtt", "both"],
          "description": "Transport mode. 'mqtt' is recommended for reliability and bidirectional communication.",
          "default": "webhook"
        },
        "mqtt_broker": {
          "type": "string",
          "description": "MQTT broker hostname or IP. Only used when mode includes 'mqtt'.",
          "default": "homeassistant.local"
        },
        "mqtt_port": {
          "type": "integer",
          "minimum": 1,
          "maximum": 65535,
          "description": "MQTT broker port.",
          "default": 1883
        }
      },
      "additionalProperties": false
    },

    "volume": {
      "type": "object",
      "description": "Volume output adapter configuration. Each BS5c has one audio output controlled by a pluggable volume adapter.",
      "properties": {
        "type": {
          "type": "string",
          "enum": ["beolab5", "sonos", "bluesound", "heos", "wiim", "mozart", "ase", "powerlink", "c4amp", "hdmi", "spdif", "rca"],
          "description": "Volume adapter type. If omitted, inferred from player.type for sonos/bluesound/heos/wiim/mozart/ase, otherwise defaults to 'beolab5'.",
          "default": "beolab5"
        },
        "host": {
          "type": "string",
          "description": "Target host for volume control. Defaults vary by adapter type: 'beolab5-controller.local' for beolab5, player IP for sonos/bluesound/heos, 'localhost' for powerlink."
        },
        "max": {
          "type": "integer",
          "minimum": 0,
          "maximum": 100,
          "description": "Maximum volume cap (0-100). Volume commands are clamped to this value.",
          "default": 70
        },
        "step": {
          "type": "integer",
          "minimum": 1,
          "maximum": 20,
          "description": "Volume increment per wheel click.",
          "default": 3
        },
        "output_name": {
          "type": "string",
          "description": "Display name for the audio output shown in the UI.",
          "default": "BeoLab 5"
        },
        "zone": {
          "type": "string",
          "description": "Zone identifier (c4amp only).",
          "default": "01"
        },
        "input": {
          "type": "string",
          "description": "Source input identifier for power-on (c4amp only).",
          "default": "01"
        },
        "mixer_port": {
          "type": "integer",
          "description": "HTTP port of masterlink.py mixer API (powerlink only).",
          "default": 8768
        }
      },
      "additionalProperties": false
    },

    "cd": {
      "type": "object",
      "description": "CD player configuration.",
      "properties": {
        "device": {
          "type": "string",
          "description": "Linux device path for the CD/DVD drive.",
          "default": "/dev/sr0"
        }
      },
      "additionalProperties": false
    },

    "radio": {
      "type": "object",
      "description": "Internet radio source settings.",
      "properties": {
        "source": {
          "type": "string",
          "description": "BeoLink IR source mapping (radio, n.radio, etc.)."
        },
        "station_buttons": {
          "type": "object",
          "description": "Map remote/keypad buttons to favourite radio stations. Keys are button names ('1'-'9', '0', 'red', 'green', 'yellow', 'blue'); values are station UUIDs from the favourites list. Pressing a bound button while the radio source is selected jumps directly to that station; bound color buttons take precedence over the global balance shortcut (GREEN/YELLOW) and BLUE→JOIN handler.",
          "propertyNames": {
            "enum": ["0","1","2","3","4","5","6","7","8","9","red","green","yellow","blue"]
          },
          "additionalProperties": {
            "type": "string",
            "description": "Station UUID, or empty string to leave the slot unbound."
          }
        }
      },
      "additionalProperties": false
    },

    "spotify": {
      "type": "object",
      "description": "Spotify integration settings. Requires a Spotify Developer app with PKCE redirect URI.",
      "properties": {
        "client_id": {
          "type": "string",
          "description": "Spotify app Client ID from https://developer.spotify.com/dashboard. Leave empty to disable Spotify."
        },
        "connect_device": {
          "type": "string",
          "description": "Experimental. For network players without ShareLink (bluesound/heos/wiim), the name of the speaker's built-in Spotify Connect device to play to (matched case-insensitively). If omitted, falls back to the device name, then the active/first Connect device. Requires Spotify Premium."
        }
      },
      "additionalProperties": false
    },

    "jellyfin": {
      "type": "object",
      "description": "Jellyfin integration settings. Signing in happens on the source's own setup page (http://<device-ip>:8781/setup) via Quick Connect or username/password; the access token is stored in /etc/beosound5c/jellyfin_tokens.json, never here.",
      "properties": {
        "url": {
          "type": "string",
          "description": "Jellyfin server base URL, e.g. http://jellyfin.local:8096. Optional — it pre-fills the setup page, which then stores whatever address you actually signed in against."
        },
        "source": {
          "type": "string",
          "description": "Beo4/BeoRemote One source button that selects Jellyfin (see docs/remotes.md)."
        }
      },
      "additionalProperties": false
    },

    "news": {
      "type": "object",
      "description": "Guardian News source settings. Required if NEWS is in the menu.",
      "properties": {
        "guardian_api_key": {
          "type": "string",
          "description": "API key from https://open-platform.theguardian.com/access/. The news service will refuse to start without this."
        }
      },
      "additionalProperties": false
    },

    "masterlink": {
      "type": "object",
      "description": "B&O Master Link bus role + IR filter. Read by services/masterlink.py at startup.",
      "properties": {
        "role": {
          "type": "string",
          "enum": ["master", "provider", "link"],
          "default": "master",
          "description": "Which side of the ML bus the BS5c plays. 'master' = audio master (default; standalone collapses into this). 'provider' = N.MUSIC/N.RADIO source-center for an external master like a BS9000 (N.MUSIC verified against BC2; N.RADIO unverified). 'link' = link room receiving sources from a remote master."
        },
        "ir": {
          "type": "object",
          "description": "Filter for incoming Beo4 IR keycodes (categorised by the device-type byte in the telegram). Light/All/unknown always pass through.",
          "properties": {
            "audio": { "type": "boolean", "default": true, "description": "Forward Audio-typed Beo4 keys (Radio, CD, A.Mem, …)." },
            "video": { "type": "boolean", "default": true, "description": "Forward Video-typed Beo4 keys (TV, DVD, V.Aux, …)." }
          },
          "additionalProperties": false
        },
        "provider": {
          "type": "object",
          "description": "Provider role config: which enabled source feeds N.MUSIC vs N.RADIO when an external master requests them.",
          "properties": {
            "nmusic_source": { "type": "string", "description": "Menu key (e.g. 'SPOTIFY') to expose as N.MUSIC. Empty = don't claim N.MUSIC." },
            "nradio_source": { "type": "string", "description": "Menu key (e.g. 'RADIO') to expose as N.RADIO. Empty = don't claim N.RADIO." }
          },
          "additionalProperties": false
        },
        "link": {
          "type": "object",
          "description": "Link role config.",
          "properties": {
            "sources": {
              "type": "array",
              "items": { "type": "string", "enum": ["radio", "cd", "amem", "a.aux", "n.radio", "n.music"] },
              "description": "Beo4 source keys to surface in the LINK view (TBD) when the BS5c is a link room."
            }
          },
          "additionalProperties": false
        }
      },
      "additionalProperties": false
    },

    "showing": {
      "type": "object",
      "description": "SHOWING view configuration. Displays what's playing on a media player (e.g. Apple TV) via Home Assistant.",
      "required": ["entity_id"],
      "properties": {
        "entity_id": {
          "type": "string",
          "description": "Home Assistant media_player entity to monitor.",
          "examples": ["media_player.living_room_apple_tv", "media_player.cinema_appletv"]
        }
      },
      "additionalProperties": false
    }
  },
  "additionalProperties": false,

  "$defs": {
    "menuItem": {
      "type": "object",
      "description": "Extended menu item with source-specific configuration.",
      "required": ["id"],
      "properties": {
        "id": {
          "type": "string",
          "description": "Source or view identifier.",
          "examples": ["cd", "usb", "security"]
        },
        "hidden": {
          "type": "boolean",
          "description": "If true, the menu item starts hidden and is shown/hidden dynamically by the source service. Currently only used by CD (shown when disc inserted).",
          "default": false
        },
        "paths": {
          "type": "array",
          "items": { "type": "string" },
          "description": "File system paths to scan (USB source only).",
          "examples": [["/mnt/usb-music"]]
        },
        "dashboard": {
          "type": "string",
          "description": "Home Assistant dashboard path to embed (security source only).",
          "examples": ["dashboard-cameras/home"]
        }
      },
      "additionalProperties": false
    },

    "scene": {
      "type": "object",
      "description": "A scene that triggers a Home Assistant action when selected.",
      "required": ["id", "name", "icon", "color"],
      "properties": {
        "id": {
          "type": "string",
          "description": "Unique scene identifier. Sent to HA as the action payload."
        },
        "name": {
          "type": "string",
          "description": "Display name on the arc."
        },
        "icon": {
          "type": "string",
          "description": "Phosphor icon name (without 'ph-' prefix).",
          "examples": ["fork-knife", "fire", "sun", "power", "television"]
        },
        "color": {
          "type": "string",
          "description": "CSS color for the icon and label.",
          "examples": ["#fa0", "#c55", "#6c8", "#E50914"]
        },
        "scenes": {
          "type": "array",
          "items": { "$ref": "#/$defs/scene" },
          "description": "Nested sub-scenes. Creates a drill-down menu."
        }
      },
      "additionalProperties": false
    }
  }
}
